train,stations
train_1,"[Den Haag Centraal, Leiden Centraal, Heemstede-Aerdenhout, Haarlem, Amsterdam Sloterdijk, Amsterdam Zuid, Schiphol Airport, Leiden Centraal, Alphen a/d Rijn, Gouda]"
train_2,"[Amsterdam Zuid, Amsterdam Amstel, Amsterdam Centraal, Amsterdam Sloterdijk, Zaandam, Castricum, Alkmaar, Den Helder]"
train_3,"[Dordrecht, Rotterdam Centraal, Rotterdam Alexander, Gouda, Den Haag Centraal, Delft, Schiedam Centrum, Rotterdam Centraal]"
train_4,"[Haarlem, Beverwijk, Zaandam, Hoorn, Alkmaar, Castricum, Beverwijk]"
score,9210.0
