train,stations
train_1,"[Amsterdam Amstel, Amsterdam Zuid, Schiphol Airport, Leiden Centraal, Den Haag Centraal, Delft, Schiedam Centrum, Delft, Den Haag Centraal, Gouda]"
train_2,"[Amsterdam Centraal, Amsterdam Amstel, Amsterdam Centraal, Amsterdam Sloterdijk, Amsterdam Zuid, Schiphol Airport, Leiden Centraal, Heemstede-Aerdenhout, Haarlem, Amsterdam Sloterdijk, Zaandam, Castricum]"
train_3,"[Rotterdam Alexander, Rotterdam Centraal, Dordrecht, Rotterdam Centraal, Schiedam Centrum, Rotterdam Centraal, Rotterdam Alexander, Gouda, Alphen a/d Rijn, Leiden Centraal]"
train_4,"[Haarlem, Beverwijk, Castricum, Alkmaar, Hoorn, Zaandam, Beverwijk]"
score,8818.857142857143
