train,stations
train_1,"[Amsterdam Centraal, Amsterdam Amstel, Amsterdam Zuid, Schiphol Airport, Leiden Centraal, Heemstede-Aerdenhout, Haarlem, Beverwijk, Haarlem, Amsterdam Sloterdijk, Amsterdam Zuid]"
train_2,"[Rotterdam Alexander, Gouda, Alphen a/d Rijn, Leiden Centraal, Den Haag Centraal, Delft, Schiedam Centrum, Rotterdam Centraal, Rotterdam Alexander, Rotterdam Centraal, Dordrecht]"
train_3,"[Castricum, Zaandam, Beverwijk, Castricum, Alkmaar]"
train_4,"[Amsterdam Centraal, Amsterdam Sloterdijk, Zaandam, Hoorn, Alkmaar, Den Helder]"
score,8855.857142857143
