train,stations
train_1,"[Dordrecht, Rotterdam Centraal, Schiedam Centrum, Rotterdam Centraal, Schiedam Centrum, Rotterdam Centraal, Rotterdam Alexander, Gouda, Den Haag Centraal]"
train_2,"[Schiphol Airport, Amsterdam Zuid, Amsterdam Sloterdijk, Haarlem, Beverwijk, Zaandam, Castricum, Alkmaar]"
train_3,"[Den Haag Centraal, Delft, Den Haag Centraal, Leiden Centraal, Heemstede-Aerdenhout, Haarlem, Beverwijk, Castricum, Alkmaar, Hoorn]"
train_4,"[Hoorn, Zaandam, Amsterdam Sloterdijk, Amsterdam Centraal, Amsterdam Amstel, Amsterdam Zuid]"
train_5,"[Schiphol Airport, Leiden Centraal, Alphen a/d Rijn, Gouda]"
train_6,"[Den Helder, Alkmaar]"
train_7,"[Schiedam Centrum, Delft]"
score,8866.0
