train,stations
train_1,"[Amsterdam Zuid, Amsterdam Sloterdijk, Haarlem, Beverwijk, Castricum, Alkmaar]"
train_2,"[Schiedam Centrum, Delft, Den Haag Centraal, Leiden Centraal, Schiphol Airport, Amsterdam Zuid]"
train_3,"[Alphen a/d Rijn, Gouda, Alphen a/d Rijn, Leiden Centraal, Heemstede-Aerdenhout, Haarlem, Amsterdam Sloterdijk, Amsterdam Centraal, Amsterdam Amstel, Amsterdam Zuid]"
train_4,"[Hoorn, Zaandam, Beverwijk, Castricum, Zaandam, Amsterdam Sloterdijk]"
train_5,"[Gouda, Rotterdam Alexander, Rotterdam Centraal, Dordrecht, Rotterdam Centraal, Schiedam Centrum]"
train_6,"[Den Helder, Alkmaar, Hoorn]"
train_7,"[Den Haag Centraal, Gouda]"
score,8859.0
