train,stations
train_1,"[Amsterdam Amstel, Amsterdam Zuid, Amsterdam Sloterdijk, Amsterdam Centraal, Amsterdam Amstel, Amsterdam Centraal, Amsterdam Sloterdijk, Haarlem, Beverwijk, Castricum, Alkmaar]"
train_2,"[Schiedam Centrum, Rotterdam Centraal, Schiedam Centrum, Delft, Den Haag Centraal, Gouda, Rotterdam Alexander, Rotterdam Centraal, Dordrecht]"
train_3,"[Amsterdam Sloterdijk, Zaandam, Hoorn, Alkmaar, Den Helder]"
train_4,"[Amsterdam Zuid, Schiphol Airport, Leiden Centraal, Alphen a/d Rijn, Gouda, Den Haag Centraal, Leiden Centraal, Heemstede-Aerdenhout, Haarlem, Heemstede-Aerdenhout]"
train_5,"[Castricum, Zaandam, Beverwijk]"
score,9076.0
