train,stations
train_1,"[Hoorn, Alkmaar, Castricum, Zaandam, Beverwijk, Castricum]"
train_2,"[Rotterdam Alexander, Gouda, Alphen a/d Rijn, Leiden Centraal, Den Haag Centraal, Gouda, Rotterdam Alexander, Rotterdam Centraal, Dordrecht]"
train_3,"[Amsterdam Zuid, Amsterdam Sloterdijk, Haarlem, Heemstede-Aerdenhout, Haarlem, Beverwijk, Haarlem, Heemstede-Aerdenhout, Leiden Centraal]"
train_4,"[Leiden Centraal, Schiphol Airport, Amsterdam Zuid, Amsterdam Amstel, Amsterdam Centraal, Amsterdam Sloterdijk, Zaandam, Hoorn]"
train_5,"[Den Haag Centraal, Delft, Schiedam Centrum, Rotterdam Centraal]"
train_6,"[Den Helder, Alkmaar]"
score,8981.0
