train,stations
train_1,"[Leiden Centraal, Alphen a/d Rijn, Gouda, Rotterdam Alexander, Rotterdam Centraal, Dordrecht, Rotterdam Centraal, Rotterdam Alexander, Rotterdam Centraal]"
train_2,"[Gouda, Den Haag Centraal, Leiden Centraal, Schiphol Airport, Leiden Centraal, Heemstede-Aerdenhout, Haarlem, Beverwijk]"
train_3,"[Den Haag Centraal, Delft, Schiedam Centrum, Rotterdam Centraal]"
train_4,"[Haarlem, Amsterdam Sloterdijk, Zaandam, Beverwijk]"
train_5,"[Amsterdam Zuid, Amsterdam Amstel, Amsterdam Centraal, Amsterdam Sloterdijk, Amsterdam Zuid, Schiphol Airport]"
train_6,"[Amsterdam Sloterdijk, Zaandam, Castricum, Beverwijk, Castricum, Alkmaar, Den Helder]"
train_7,"[Alkmaar, Hoorn, Zaandam]"
score,8852.0
