train,stations
train_1,"[Amsterdam Sloterdijk, Amsterdam Zuid, Schiphol Airport, Leiden Centraal, Den Haag Centraal, Delft, Schiedam Centrum, Rotterdam Centraal, Rotterdam Alexander, Gouda, Den Haag Centraal]"
train_2,"[Dordrecht, Rotterdam Centraal, Rotterdam Alexander, Gouda, Alphen a/d Rijn, Leiden Centraal, Heemstede-Aerdenhout, Haarlem, Beverwijk, Castricum]"
train_3,"[Castricum, Beverwijk, Zaandam, Castricum, Alkmaar, Den Helder]"
train_4,"[Amsterdam Amstel, Amsterdam Zuid, Amsterdam Amstel, Amsterdam Centraal, Amsterdam Sloterdijk, Zaandam, Hoorn, Alkmaar]"
score,8831.857142857143
