train,stations
train_1,"[Rotterdam Alexander, Gouda, Den Haag Centraal, Leiden Centraal, Schiphol Airport, Amsterdam Zuid, Amsterdam Amstel, Amsterdam Centraal, Amsterdam Sloterdijk]"
train_2,"[Alphen a/d Rijn, Gouda, Den Haag Centraal, Delft, Schiedam Centrum, Rotterdam Centraal, Schiedam Centrum, Rotterdam Centraal, Rotterdam Alexander, Rotterdam Centraal, Dordrecht]"
train_3,"[Heemstede-Aerdenhout, Haarlem, Amsterdam Sloterdijk, Amsterdam Zuid, Amsterdam Sloterdijk, Zaandam, Castricum, Alkmaar, Den Helder]"
train_4,"[Alkmaar, Castricum, Beverwijk, Haarlem, Heemstede-Aerdenhout, Leiden Centraal, Alphen a/d Rijn]"
train_5,"[Beverwijk, Zaandam, Hoorn, Alkmaar]"
score,9052.0
