train,stations
train_1,"[Amsterdam Sloterdijk, Haarlem, Heemstede-Aerdenhout, Leiden Centraal, Alphen a/d Rijn, Gouda, Den Haag Centraal, Delft]"
train_2,"[Den Haag Centraal, Leiden Centraal, Schiphol Airport, Amsterdam Zuid, Amsterdam Amstel, Amsterdam Centraal]"
train_3,"[Amsterdam Centraal, Amsterdam Sloterdijk, Zaandam, Castricum]"
train_4,"[Den Helder, Alkmaar, Castricum, Beverwijk, Haarlem, Amsterdam Sloterdijk, Amsterdam Zuid]"
train_5,"[Beverwijk, Zaandam, Hoorn, Alkmaar]"
train_6,"[Delft, Schiedam Centrum]"
train_7,"[Dordrecht, Rotterdam Centraal, Schiedam Centrum, Rotterdam Centraal, Rotterdam Alexander, Gouda]"
score,8903.0
