train,stations
train_1,"[Zaandam, Beverwijk, Castricum, Zaandam, Amsterdam Sloterdijk, Haarlem, Beverwijk]"
train_2,"[Heemstede-Aerdenhout, Haarlem, Heemstede-Aerdenhout, Leiden Centraal, Schiphol Airport, Amsterdam Zuid, Amsterdam Amstel, Amsterdam Centraal, Amsterdam Sloterdijk, Amsterdam Zuid, Schiphol Airport]"
train_3,"[Gouda, Rotterdam Alexander, Rotterdam Centraal, Schiedam Centrum, Delft, Den Haag Centraal, Gouda, Alphen a/d Rijn, Leiden Centraal, Den Haag Centraal]"
train_4,"[Zaandam, Hoorn, Alkmaar, Castricum, Alkmaar, Den Helder]"
score,8857.857142857143
