train,stations
train_1,"[Dordrecht, Rotterdam Centraal, Schiedam Centrum, Rotterdam Centraal, Rotterdam Alexander, Gouda, Alphen a/d Rijn, Leiden Centraal, Heemstede-Aerdenhout, Haarlem, Heemstede-Aerdenhout, Haarlem]"
train_2,"[Schiedam Centrum, Delft, Den Haag Centraal, Gouda, Den Haag Centraal, Leiden Centraal, Schiphol Airport, Amsterdam Zuid, Amsterdam Sloterdijk]"
train_3,"[Amsterdam Zuid, Amsterdam Amstel, Amsterdam Centraal, Amsterdam Sloterdijk, Zaandam, Hoorn, Alkmaar, Den Helder]"
train_4,"[Alkmaar, Castricum, Zaandam, Amsterdam Sloterdijk, Haarlem, Beverwijk, Castricum, Zaandam, Beverwijk]"
score,9166.0
