train,stations
train_1,"[Amsterdam Zuid, Amsterdam Amstel, Amsterdam Centraal, Amsterdam Sloterdijk, Amsterdam Zuid, Schiphol Airport, Leiden Centraal, Alphen a/d Rijn, Gouda, Den Haag Centraal]"
train_2,"[Castricum, Beverwijk, Haarlem, Heemstede-Aerdenhout, Leiden Centraal, Den Haag Centraal, Delft, Schiedam Centrum, Rotterdam Centraal, Rotterdam Alexander, Gouda]"
train_3,"[Den Helder, Alkmaar, Castricum, Zaandam, Amsterdam Sloterdijk, Haarlem, Amsterdam Sloterdijk, Zaandam, Beverwijk]"
train_4,"[Zaandam, Hoorn, Alkmaar]"
score,8861.857142857143
