train,stations
train_1,"[Castricum, Beverwijk, Haarlem, Amsterdam Sloterdijk, Zaandam, Castricum, Alkmaar, Den Helder]"
train_2,"[Amsterdam Amstel, Amsterdam Zuid, Amsterdam Amstel, Amsterdam Centraal, Amsterdam Sloterdijk, Amsterdam Zuid, Schiphol Airport, Leiden Centraal, Den Haag Centraal, Gouda]"
train_3,"[Alkmaar, Hoorn, Zaandam, Beverwijk]"
train_4,"[Den Haag Centraal, Delft, Schiedam Centrum, Rotterdam Centraal, Rotterdam Alexander, Gouda, Alphen a/d Rijn, Leiden Centraal, Heemstede-Aerdenhout, Haarlem, Amsterdam Sloterdijk]"
score,8857.857142857143
