train,stations
train_1,"[Haarlem, Heemstede-Aerdenhout, Leiden Centraal, Alphen a/d Rijn, Gouda, Rotterdam Alexander, Rotterdam Centraal, Schiedam Centrum, Delft, Den Haag Centraal]"
train_2,"[Heemstede-Aerdenhout, Haarlem, Amsterdam Sloterdijk, Amsterdam Centraal, Amsterdam Sloterdijk, Amsterdam Centraal, Amsterdam Amstel, Amsterdam Zuid, Schiphol Airport, Leiden Centraal, Den Haag Centraal, Gouda]"
train_3,"[Castricum, Beverwijk, Haarlem, Beverwijk, Zaandam, Amsterdam Sloterdijk, Amsterdam Zuid]"
train_4,"[Den Helder, Alkmaar, Hoorn, Zaandam, Castricum, Alkmaar]"
score,8844.857142857143
