train,stations
train_1,"[Apeldoorn, Zutphen, Dieren, Arnhem Centraal, Ede-Wageningen, Utrecht Centraal, Hilversum, Almere Centrum, Amsterdam Amstel, Amsterdam Centraal, Amsterdam Amstel, Amsterdam Zuid]"
train_2,"[Rotterdam Alexander, Gouda, Den Haag Centraal, Delft, Den Haag Laan v NOI, Leiden Centraal, Den Haag HS, Gouda, Utrecht Centraal, Amsterdam Centraal, Almere Centrum]"
train_3,"[Haarlem, Amsterdam Sloterdijk, Amsterdam Centraal, Amsterdam Sloterdijk, Amsterdam Zuid, Schiphol Airport, Leiden Centraal, Alphen a/d Rijn, Utrecht Centraal, Schiphol Airport]"
train_4,"[Den Haag HS, Delft, Schiedam Centrum, Rotterdam Centraal, Rotterdam Alexander, Rotterdam Blaak, Dordrecht, Roosendaal, Etten-Leur, Breda, Dordrecht, Rotterdam Centraal, Dordrecht, Rotterdam Blaak, Schiedam Centrum]"
train_5,"[Enschede, Hengelo, Almelo, Deventer, Apeldoorn, Amersfoort, Utrecht Centraal, s-Hertogenbosch, Oss, Nijmegen, Arnhem Centraal]"
train_6,"[Zutphen, Deventer, Zwolle, Assen, Groningen, Leeuwarden, Heerenveen, Steenwijk]"
train_7,"[Den Haag Centraal, Leiden Centraal, Heemstede-Aerdenhout, Haarlem, Beverwijk, Castricum, Zaandam, Beverwijk, Zaandam, Amsterdam Sloterdijk, Amsterdam Centraal, Amsterdam Amstel, Utrecht Centraal]"
train_8,"[Maastricht, Sittard, Roermond, Weert, Eindhoven, Tilburg, s-Hertogenbosch, Eindhoven, Helmond, Venlo]"
score,6349.966292134832
