train,stations
train_1,"[Amsterdam Sloterdijk, Amsterdam Zuid, Amsterdam Amstel, Amsterdam Centraal, Amsterdam Sloterdijk, Amsterdam Zuid, Schiphol Airport, Leiden Centraal, Alphen a/d Rijn, Gouda]"
train_2,"[Beverwijk, Haarlem, Heemstede-Aerdenhout, Leiden Centraal, Den Haag Centraal, Delft, Schiedam Centrum, Rotterdam Centraal, Dordrecht, Rotterdam Centraal, Rotterdam Alexander]"
train_3,"[Castricum, Beverwijk, Zaandam, Amsterdam Sloterdijk, Haarlem]"
train_4,"[Rotterdam Alexander, Gouda, Den Haag Centraal]"
train_5,"[Den Helder, Alkmaar, Hoorn, Zaandam, Castricum, Alkmaar]"
score,9086.0
