train,stations
train_1,"[Hoorn, Zaandam, Amsterdam Sloterdijk, Amsterdam Zuid, Schiphol Airport, Leiden Centraal, Alphen a/d Rijn, Leiden Centraal]"
train_2,"[Amsterdam Centraal, Amsterdam Sloterdijk, Haarlem, Beverwijk, Castricum, Zaandam, Beverwijk, Castricum, Alkmaar]"
train_3,"[Amsterdam Sloterdijk, Haarlem, Heemstede-Aerdenhout, Leiden Centraal, Den Haag Centraal, Gouda, Den Haag Centraal, Delft, Schiedam Centrum, Rotterdam Centraal]"
train_4,"[Dordrecht, Rotterdam Centraal, Rotterdam Alexander, Gouda, Alphen a/d Rijn]"
train_5,"[Amsterdam Centraal, Amsterdam Amstel, Amsterdam Zuid]"
train_6,"[Den Helder, Alkmaar]"
train_7,"[Alkmaar, Hoorn]"
score,8863.0
