train,stations
train_1,"[Heemstede-Aerdenhout, Haarlem, Beverwijk, Zaandam, Castricum, Beverwijk, Castricum, Alkmaar]"
train_2,"[Den Helder, Alkmaar, Hoorn, Zaandam, Amsterdam Sloterdijk, Haarlem, Heemstede-Aerdenhout]"
train_3,"[Heemstede-Aerdenhout, Leiden Centraal, Den Haag Centraal, Gouda, Rotterdam Alexander, Rotterdam Centraal, Schiedam Centrum, Delft, Den Haag Centraal]"
train_4,"[Rotterdam Alexander, Gouda, Alphen a/d Rijn, Leiden Centraal, Schiphol Airport, Amsterdam Zuid, Amsterdam Amstel, Amsterdam Centraal, Amsterdam Sloterdijk, Amsterdam Zuid, Amsterdam Amstel]"
score,8839.857142857143
