train,stations
train_1,"[Gouda, Rotterdam Alexander, Rotterdam Centraal, Dordrecht, Rotterdam Centraal, Schiedam Centrum, Delft]"
train_2,"[Delft, Den Haag Centraal, Leiden Centraal, Heemstede-Aerdenhout, Leiden Centraal, Alphen a/d Rijn, Gouda, Den Haag Centraal]"
train_3,"[Amsterdam Zuid, Amsterdam Sloterdijk, Amsterdam Centraal, Amsterdam Amstel, Amsterdam Zuid, Schiphol Airport, Leiden Centraal]"
train_4,"[Amsterdam Amstel, Amsterdam Centraal, Amsterdam Sloterdijk, Haarlem, Heemstede-Aerdenhout, Haarlem, Beverwijk, Zaandam, Castricum, Beverwijk]"
train_5,"[Amsterdam Centraal, Amsterdam Sloterdijk, Zaandam, Hoorn, Alkmaar, Castricum, Alkmaar, Den Helder]"
score,9054.0
