train,stations
train_1,"[Hoorn, Zaandam, Amsterdam Sloterdijk, Amsterdam Centraal, Amsterdam Amstel, Amsterdam Zuid, Schiphol Airport, Leiden Centraal, Alphen a/d Rijn]"
train_2,"[Castricum, Beverwijk, Zaandam, Castricum, Alkmaar, Hoorn]"
train_3,"[Gouda, Den Haag Centraal, Leiden Centraal, Heemstede-Aerdenhout, Haarlem]"
train_4,"[Alphen a/d Rijn, Gouda, Rotterdam Alexander, Rotterdam Centraal, Dordrecht, Rotterdam Centraal, Schiedam Centrum, Delft, Den Haag Centraal]"
train_5,"[Amsterdam Zuid, Amsterdam Sloterdijk, Haarlem, Beverwijk]"
train_6,"[Den Helder, Alkmaar]"
score,9002.0
