train,stations
train_1,"[Amsterdam Amstel, Amsterdam Centraal, Amsterdam Amstel, Amsterdam Zuid, Amsterdam Sloterdijk, Haarlem, Heemstede-Aerdenhout, Leiden Centraal, Den Haag Centraal, Delft, Schiedam Centrum, Rotterdam Centraal]"
train_2,"[Beverwijk, Haarlem, Amsterdam Sloterdijk, Amsterdam Zuid, Schiphol Airport, Leiden Centraal]"
train_3,"[Heemstede-Aerdenhout, Haarlem, Amsterdam Sloterdijk, Amsterdam Centraal, Amsterdam Sloterdijk, Zaandam, Beverwijk, Castricum, Alkmaar, Hoorn]"
train_4,"[Gouda, Rotterdam Alexander, Rotterdam Centraal, Dordrecht]"
train_5,"[Leiden Centraal, Alphen a/d Rijn, Gouda, Den Haag Centraal]"
train_6,"[Hoorn, Zaandam, Castricum, Alkmaar, Den Helder]"
score,8952.0
