train,stations
train_1,"[Amsterdam Zuid, Amsterdam Amstel, Amsterdam Centraal, Amsterdam Sloterdijk, Haarlem, Heemstede-Aerdenhout, Leiden Centraal]"
train_2,"[Den Haag Centraal, Leiden Centraal, Schiphol Airport, Amsterdam Zuid, Amsterdam Sloterdijk, Amsterdam Centraal, Amsterdam Amstel, Amsterdam Centraal, Amsterdam Sloterdijk, Zaandam, Beverwijk]"
train_3,"[Beverwijk, Haarlem]"
train_4,"[Den Helder, Alkmaar, Hoorn, Zaandam, Castricum, Beverwijk]"
train_5,"[Castricum, Alkmaar]"
train_6,"[Rotterdam Centraal, Rotterdam Alexander, Gouda, Den Haag Centraal, Delft, Schiedam Centrum, Rotterdam Centraal, Rotterdam Alexander, Rotterdam Centraal, Dordrecht]"
train_7,"[Gouda, Alphen a/d Rijn, Leiden Centraal]"
score,8875.0
