train,stations
train_1,"[Rotterdam Alexander, Gouda, Rotterdam Alexander, Gouda, Alphen a/d Rijn, Leiden Centraal, Alphen a/d Rijn, Gouda]"
train_2,"[Zaandam, Amsterdam Sloterdijk, Haarlem, Heemstede-Aerdenhout, Haarlem, Heemstede-Aerdenhout, Leiden Centraal, Alphen a/d Rijn, Leiden Centraal, Schiphol Airport, Amsterdam Zuid]"
train_3,"[Zaandam, Beverwijk, Haarlem, Beverwijk, Castricum, Beverwijk]"
train_4,"[Den Haag Centraal, Leiden Centraal, Alphen a/d Rijn, Leiden Centraal, Heemstede-Aerdenhout, Leiden Centraal, Schiphol Airport, Leiden Centraal]"
train_5,"[Schiedam Centrum, Rotterdam Centraal, Rotterdam Alexander, Gouda, Alphen a/d Rijn, Gouda, Rotterdam Alexander, Rotterdam Centraal, Rotterdam Alexander, Gouda]"
train_6,"[Haarlem, Amsterdam Sloterdijk, Haarlem, Beverwijk, Haarlem, Heemstede-Aerdenhout, Leiden Centraal, Schiphol Airport, Amsterdam Zuid, Schiphol Airport, Amsterdam Zuid]"
train_7,"[Rotterdam Centraal, Dordrecht, Rotterdam Centraal, Rotterdam Alexander, Rotterdam Centraal, Schiedam Centrum, Rotterdam Centraal, Schiedam Centrum, Rotterdam Centraal, Dordrecht, Rotterdam Centraal]"
score,5676.857142857143
