train,stations
train_1,"[Rotterdam Centraal, Dordrecht, Rotterdam Centraal, Schiedam Centrum, Rotterdam Centraal, Schiedam Centrum, Rotterdam Centraal, Schiedam Centrum, Delft, Den Haag Centraal, Gouda, Den Haag Centraal]"
train_2,"[Schiedam Centrum, Rotterdam Centraal, Rotterdam Alexander, Gouda, Alphen a/d Rijn, Leiden Centraal, Den Haag Centraal, Leiden Centraal, Heemstede-Aerdenhout, Haarlem, Heemstede-Aerdenhout, Haarlem]"
train_3,"[Amsterdam Centraal, Amsterdam Amstel, Amsterdam Centraal, Amsterdam Sloterdijk, Amsterdam Zuid, Schiphol Airport, Amsterdam Zuid, Amsterdam Amstel, Amsterdam Centraal, Amsterdam Sloterdijk, Zaandam, Hoorn]"
train_4,"[Den Helder, Alkmaar, Castricum, Alkmaar, Hoorn]"
train_5,"[Heemstede-Aerdenhout, Leiden Centraal, Schiphol Airport, Amsterdam Zuid]"
train_6,"[Amsterdam Centraal, Amsterdam Amstel, Amsterdam Centraal, Amsterdam Amstel, Amsterdam Zuid, Amsterdam Sloterdijk, Haarlem, Beverwijk, Castricum, Zaandam]"
train_7,"[Hoorn, Zaandam, Beverwijk, Castricum]"
score,8690.0
