train,stations
train_1,"[Lelystad Centrum, Almere Centrum, Hilversum, Utrecht Centraal, s-Hertogenbosch, Eindhoven, Helmond]"
train_2,"[Rotterdam Blaak, Rotterdam Alexander, Rotterdam Centraal, Schiedam Centrum, Delft, Den Haag Centraal, Gouda, Den Haag HS, Delft, Schiedam Centrum, Rotterdam Centraal, Dordrecht, Rotterdam Blaak, Schiedam Centrum, Delft, Den Haag Laan v NOI]"
train_3,"[Maastricht, Sittard, Roermond, Weert, Eindhoven, Tilburg, Breda, Dordrecht, Roosendaal, Etten-Leur]"
train_4,"[Ede-Wageningen, Utrecht Centraal, Gouda, Alphen a/d Rijn, Utrecht Centraal, Amsterdam Centraal, Amsterdam Sloterdijk, Zaandam, Amsterdam Sloterdijk, Amsterdam Zuid, Amsterdam Amstel, Amsterdam Centraal]"
train_5,"[Den Haag Laan v NOI, Leiden Centraal, Schiphol Airport, Amsterdam Zuid, Schiphol Airport, Utrecht Centraal, Amsterdam Amstel, Utrecht Centraal, Amersfoort, Apeldoorn, Deventer]"
train_6,"[Den Haag HS, Leiden Centraal, Heemstede-Aerdenhout, Haarlem, Beverwijk, Castricum, Alkmaar, Hoorn, Zaandam, Castricum, Zaandam, Beverwijk]"
train_7,"[Enschede, Hengelo, Almelo, Deventer, Zwolle, Steenwijk, Heerenveen, Leeuwarden, Groningen, Assen]"
train_8,"[Deventer, Zutphen, Dieren, Arnhem Centraal, Ede-Wageningen, Arnhem Centraal, Nijmegen, Oss, s-Hertogenbosch, Tilburg]"
score,6056.887640449438
