train,stations
train_1,"[Rotterdam Centraal, Dordrecht, Rotterdam Centraal, Schiedam Centrum, Rotterdam Centraal, Rotterdam Alexander, Gouda, Alphen a/d Rijn, Leiden Centraal, Schiphol Airport, Amsterdam Zuid]"
train_2,"[Castricum, Beverwijk, Haarlem, Amsterdam Sloterdijk, Amsterdam Zuid, Amsterdam Amstel, Amsterdam Centraal, Amsterdam Amstel, Amsterdam Centraal, Amsterdam Sloterdijk, Zaandam]"
train_3,"[Haarlem, Heemstede-Aerdenhout, Leiden Centraal, Den Haag Centraal, Delft, Schiedam Centrum, Delft, Den Haag Centraal, Gouda, Rotterdam Alexander, Gouda]"
train_4,"[Beverwijk, Zaandam, Castricum, Alkmaar, Hoorn, Zaandam]"
score,8819.857142857143
