train,stations
train_1,"[Gouda, Alphen a/d Rijn, Leiden Centraal, Schiphol Airport, Amsterdam Zuid, Schiphol Airport, Amsterdam Zuid, Amsterdam Amstel, Amsterdam Centraal, Amsterdam Sloterdijk, Amsterdam Centraal, Amsterdam Sloterdijk, Zaandam]"
train_2,"[Amsterdam Amstel, Amsterdam Zuid, Amsterdam Sloterdijk, Haarlem, Heemstede-Aerdenhout, Leiden Centraal, Heemstede-Aerdenhout, Haarlem, Beverwijk, Zaandam]"
train_3,"[Beverwijk, Castricum, Alkmaar, Castricum, Zaandam, Hoorn, Alkmaar]"
train_4,"[Dordrecht, Rotterdam Centraal, Rotterdam Alexander, Gouda, Den Haag Centraal, Delft, Schiedam Centrum, Rotterdam Centraal, Schiedam Centrum, Delft, Den Haag Centraal, Leiden Centraal]"
score,8810.857142857143
