train,stations
train_1,"[Castricum, Zaandam, Amsterdam Sloterdijk, Amsterdam Centraal, Amsterdam Amstel, Amsterdam Zuid, Amsterdam Sloterdijk, Amsterdam Centraal, Amsterdam Sloterdijk, Haarlem]"
train_2,"[Alkmaar, Castricum, Beverwijk, Haarlem, Heemstede-Aerdenhout, Leiden Centraal, Schiphol Airport, Amsterdam Zuid]"
train_3,"[Den Haag Centraal, Leiden Centraal, Alphen a/d Rijn, Gouda, Rotterdam Alexander, Rotterdam Centraal, Schiedam Centrum, Rotterdam Centraal, Schiedam Centrum, Delft, Den Haag Centraal, Gouda]"
train_4,"[Den Helder, Alkmaar, Hoorn, Zaandam, Beverwijk]"
score,8856.857142857143
