train,stations
train_1,"[Amsterdam Zuid, Amsterdam Sloterdijk, Amsterdam Centraal, Amsterdam Amstel, Amsterdam Zuid, Schiphol Airport, Leiden Centraal, Heemstede-Aerdenhout, Haarlem, Beverwijk, Castricum]"
train_2,"[Beverwijk, Zaandam, Amsterdam Sloterdijk, Haarlem, Heemstede-Aerdenhout, Leiden Centraal, Den Haag Centraal, Gouda]"
train_3,"[Rotterdam Centraal, Schiedam Centrum, Delft, Den Haag Centraal, Leiden Centraal, Alphen a/d Rijn, Gouda, Rotterdam Alexander, Rotterdam Centraal, Dordrecht]"
train_4,"[Den Helder, Alkmaar, Castricum, Zaandam, Hoorn, Alkmaar]"
score,9188.0
