train,stations
train_1,"[Gouda, Alphen a/d Rijn, Leiden Centraal, Heemstede-Aerdenhout, Haarlem, Amsterdam Sloterdijk, Amsterdam Zuid, Schiphol Airport, Leiden Centraal, Den Haag Centraal]"
train_2,"[Dordrecht, Rotterdam Centraal, Rotterdam Alexander, Gouda, Den Haag Centraal, Delft, Schiedam Centrum, Rotterdam Centraal]"
train_3,"[Beverwijk, Castricum, Alkmaar, Hoorn, Zaandam, Beverwijk, Haarlem]"
train_4,"[Den Helder, Alkmaar, Castricum, Zaandam, Amsterdam Sloterdijk, Amsterdam Centraal, Amsterdam Amstel, Amsterdam Zuid]"
score,9210.0
