train,stations
train_1,"[Schiphol Airport, Leiden Centraal, Den Haag HS, Gouda, Utrecht Centraal, Alphen a/d Rijn, Gouda, Den Haag Centraal, Leiden Centraal, Den Haag Laan v NOI, Delft, Den Haag HS]"
train_2,"[Amsterdam Zuid, Amsterdam Sloterdijk, Amsterdam Centraal, Utrecht Centraal, s-Hertogenbosch, Oss, Nijmegen, Arnhem Centraal, Dieren, Zutphen, Apeldoorn]"
train_3,"[Lelystad Centrum, Almere Centrum, Amsterdam Amstel, Amsterdam Centraal, Almere Centrum, Hilversum, Utrecht Centraal, Schiphol Airport, Amsterdam Zuid, Amsterdam Amstel]"
train_4,"[Arnhem Centraal, Ede-Wageningen, Utrecht Centraal, Hilversum, Amsterdam Amstel, Utrecht Centraal, Amersfoort, Apeldoorn, Deventer, Zutphen]"
train_5,"[Schiedam Centrum, Rotterdam Blaak, Dordrecht, Breda, Etten-Leur, Roosendaal, Dordrecht, Rotterdam Centraal, Schiedam Centrum, Delft, Den Haag Centraal, Gouda, Rotterdam Alexander, Rotterdam Centraal]"
train_6,"[Castricum, Beverwijk, Zaandam, Castricum, Alkmaar, Hoorn, Zaandam, Amsterdam Sloterdijk, Haarlem, Heemstede-Aerdenhout, Leiden Centraal, Alphen a/d Rijn]"
train_7,"[Venlo, Helmond, Eindhoven, Tilburg, s-Hertogenbosch, Eindhoven, Weert, Roermond, Sittard, Heerlen]"
train_8,"[Enschede, Hengelo, Almelo, Deventer, Zwolle, Steenwijk, Heerenveen, Leeuwarden, Groningen, Assen]"
score,6789.404494382023
